stt,link,thoigian,giaphong,dientich,vido,kinhdo,drmd,diachi,chitiet
0,https://phongtro123.com/cho-thue-phong-tro-gia-re-ai-co-nhu-cau-lh-bac-cay-pr585887.html,Ngày đăng11 giờ trước,Giá cho thuê2.5 triệu/tháng,Diện tích18m2,"79 phố lạc nghiệp Đường Trần Khát Chân, Phường Thanh Nhàn, Quận Hai Bà Trưng, Hà Nội",21.007834,2.7,105.8587519,"Phòng trọ sạch sẽ thoáng mát ,gần khu trung tâm lớn các trường đại học lớn ở hà nội.Có sân rộng thoải mái an ninh tốt .Qua địa chỉ xem nhà thoái mái nhé"
5,https://phongtro123.com/cho-thue-phong-tro-full-do-tai-tay-ho-sach-dep-gia-3tr-pr304758.html,Ngày đăng23 giờ trước,Giá cho thuê2.6 triệu/tháng,Diện tích18m2,"Đường Lạc Long Quân, Phường Thụy Khuê, Quận Tây Hồ, Hà Nội",21.0641913,3.7,105.8097712,"️️️️️ PHÒNG TRỌ FULL ĐỒ GIÁ RẺ TẠI HỒ TÂY.- Địa chỉ: 56 Ngõ 259 Trích Sài, Tây Hồ, HN.- Nội thất: Giường, tủ quần áo, điều hoà, nóng lạnh, bàn trang điểm, máy giặt chung, Bếp nấu ăn...- Phòng tầng 2, đi bộ 10 bước chân ra hồ, view đẹp, thoáng mát, có chỗ để xe . Gần các đường Văn Cao, Thụy Khuê, Trích Sài, Nguyễn Đình Thi, Lạc Long Quân, Võng Thị...- Giá 2tr6tr. ). Ưu tiên nữ.- Giờ giấc tự do, không chung chủ. Vệ sinh chung với 1 bạn nữ, có người dọn nhà vệ sinh free hàng tuần nên rất sạch sẽ.️️️ Lh chính chủ:. Phòng như ảnh"
3,https://phongtro123.com/cho-thue-can-ho-2-phong-ngu-50m2-full-do-tai-lac-long-quan-tay-ho-gia-chi-6tr-thang-pr585856.html,Ngày đăng23 giờ trước,Giá cho thuê6 triệu/tháng,Diện tích50m2,"Đường Lạc Long Quân, Phường Bưởi, Quận Tây Hồ, Hà Nội",21.0550926,2.3,105.8088761,"Cho thuê căn hộ cao cấp 2pn TẠI 16 ngõ 612 Lạc Long Quân - Tây Hồ.- Căn hộ gồm 2 Phòng ngủ và 1 Phòng khách các khu rộng rãi, thuận tiện sinh hoạt- Nội thất: 3 máy lạnh, giường gỗ, tủ gỗ, đệm lò xo, tủ lạnh, bếp riêng, tivi,. Nhà có trang bị thang máy, máy giặt (sân thượng)- Camera an ninh 24/7- Vị trí: ngay khu ẩm thực sen hồ tây, đường đi bộ Trịnh Công Sơn, công viên nước hồ tây, thung lũng hoa hồ tâyGiá thuê: 6 triệu / tháng ( Phòng như ảnh )️️ Liên hệ chính chủ:"
4,https://phongtro123.com/cho-thue-phong-tro-khep-kin-du-do-gia-2tr-tai-tam-trinh-hoang-mai-pr315957.html,Ngày đăng23 giờ trước,Giá cho thuê2 triệu/tháng,Diện tích18m2,"Đường Tam Trinh, Phường Hoàng Văn Thụ, Quận Hoàng Mai, Hà Nội",20.9848364,3.1,105.8598553,"Phòng trọ 263 Tam Trinh, Hoàng Mai, khép kín điều hòa giá 2tr- Diện tích 18m2, tầng 5- Vệ sinh khép kín, điều hòa, nóng lạnh, giường- Điện nước công tơ riêng, 3k5/số- Giờ giấc tự do, an ninh đảm bảo- Giá thuê 2tr đóng 1 tháng 1Nhà mặt đường, cạnh bến xe bus, gần Time city, Lĩnh Nam, Kim Ngưu, Minh Khai, Thanh Nhàn, Đền Lừ.- Lh: ( Miễn MG, TG )."
1,https://phongtro123.com/cho-thue-phong-tro-sinh-vien-vip-pr585866.html,Ngày đăng20 giờ trước,Giá cho thuê3 triệu/tháng,Diện tích25m2,"71 ngõ 119 đường Đường Giáp Bát, Phường Giáp Bát, Quận Hoàng Mai, Hà Nội",20.9859994,3.3,105.844173,"Cho thuê phòng trọ sinh viên Vip Đầy đủ....đủ tiện nghi ( Bàn ghế , giường tủ , tivi tủ lạnh điều hòa ---- nhà bếp , vệ sinh nóng lạnh....) phòng đôi xe máy 02 chiếc.....GIÁ; 3 triệu 1 tháng , phụ phí tính ngoài... Phòng tầng 4 ... Rộng thoáng Ngõ rộng ôtô đỗ cửa An ninh tốt..... Các cá nhân , khách du lịch hoặc Vợ chồng trẻ ở rất hợp. Liên hệ : 0378 838390."
6,https://phongtro123.com/cho-thue-phong-tro-khep-kin-full-do-tai-au-co-tay-ho-pr583859.html,Ngày đăng23 giờ trước,Giá cho thuê4 triệu/tháng,Diện tích35m2,"Đường Âu Cơ, Phường Yên Phụ, Quận Tây Hồ, Hà Nội",21.060536,2.5,105.8331321,"Cho thuê phòng full đồ khép kín.- Địa chỉ: số nhà 28 ngõ 22/75 Tứ Liên, Tây Hồ, Hà Nội ( hoặc ngõ 310/50 nghi tàm rẽ trái)- Phòng : full đồ ( điều hoà Casper 12000 2 chiều, nóng lạnh, giường tủ gỗ, tivi Samsung 4k 43inch, tủ lạnh máy giặt)- Phòng 25m2: 4.000.000 vnd-Tầng 1: phòng khách: tivi Samsung 4k 49inch có tủ lạnh Panasonic 255l, bếp từ đôi, camera an ninh 24/24, chỗ để xe thoải mái-Tầng thượng: có máy giặt sân phơi thoáng mátNgười thuê chỉ việc sách đồ cá nhân đến ở.Nhà không chung chủ, gần Hồ tây, gần chợ, siêu thị, lên phố chơi chỉ mất 5 phút xe máy, khu ở thoáng mát sạch sẽ, nhiều người nước ngoài sinh sống.Phòng chuẩn 100% như ảnhLiên hệ chính chủ: Miễn Quảng Cáo, Môi Giới"
2,https://phongtro123.com/tinh-thanh/ha-noi/phong-tro-khep-kin-15-18m2-gia-1tr2-1tr5.html,Ngày đăng22 giờ trước,Giá cho thuê1.2 triệu/tháng,Diện tích18m2,"ngách 4/17, nhà 22 Đường Thanh Bình, Quận Hà Đông, Hà Nội",20.9770755,2.3,105.7802549,"nhà 3 tầng, phòng khép kín, có chìa khoá riêng, chính chủ không qua trung gian, cách điểm bus 200m, tiện đi lại, gần bệnh viện, gần nhiều trường Bưu Chính viễn thông, học viện An Ninh, Y học cổ truyền...."
8,https://phongtro123.com/phong-sach-dep-khep-kin-quan-ba-dinh-pr584190.html,Ngày đăng50 phút trước,Giá cho thuê4 triệu/tháng,Diện tích20m2,"41 Linh Lang, Phường Cống Vị, Quận Ba Đình, Hà Nội",21.0355718,4.0,105.8105576,"Cho thuê phòng trọ tại số 41 phố Linh Lang, Ba Đình, Hà Nội chính chủ cho thuê, ở tự do sinh hoạt không ở cùng chủ- Phòng sạch đẹp, của sổ to nên ánh sáng và gió vào phòng rất thoải mái, sáng sủa, mát mẽ- Khu trọ khách hàng lịch sự, văn minh, yên tĩnh. .- Phòng có kệ bếp nấu ăn, nhà vệ sinh riêng từng phòng rất sạch sẽ và tiện nghi- Wifi lướt vi vu,- Có nội thất sẵn như: tivi, điều hoà, nóng lạnh, máy giặt...- Gần nhà có đầy đủ các tiện ích như công viên, an toàn văn minh, gần chợ, trường học, phố lớn..- Điện nước đầy đủ"
7,https://phongtro123.com/phong-khep-kin-sach-dep-quan-ba-dinh-pr585428.html,Ngày đăng51 phút trước,Giá cho thuê3.5 triệu/tháng,Diện tích20m2,"Linh Lang, Phường Cống Vị, Quận Ba Đình, Hà Nội",21.0350065,1.9,105.8104056,"- Phòng sạch đẹp, khách hàng lịch sự, văn minh, yên tĩnh. Điện nước đầy đủ.- Phòng có kệ bếp nấu ăn, wifi, tivi, điều hoà, nóng lạnh, máy giặt...- Vị trí gần công viên, an toàn văn minh, gần chợ, trường học, phố lớn..- Đ/chi: số 41 phố Linh Lang, Ba Đình, Hà Nội ( Chính chủ, ko ở chung chủ)"
