stt,thoigian,giaphong,dientich,vido,kinhdo,khutro,drmd,kcdc,khepkin,tiennghi,thuantien,diachi,chitiet
55,03/2021,4000000,25,21.02970580021538, 105.77047435714887,ccmn,3.83,165.63,khepkin,"Số 28 Ngõ 63 Đường Lê Đức Thọ, Phường Mỹ Đình 2, Quận Nam Từ Liêm, Hà Nội","  trong chung cư mini 8 tầng mới xây xong ô tô đỗ cửa.- địa chỉ: số 28, ngõ 63 lê đức thọ, phường mỹ đình 2.- nhà mới xây.  khép kín, cửa sổ ban công thoáng mát, có sẵn điều hòa, nóng lạnh giường tủ. rất phù hợp cho hộ gia đình người đi làm sinh viên. làm văn  đại diện, trung tâm đào tạo ngoại ngữ,  marketing online... vv.- : 25m2 đến 35m2 giá: 4,0 đến 5,0 triệu /1 tháng.tiện ích:+ tủ bếp, chậu rửa tiện lợi.+ internet cáp quang. đầy đủ.+ thang máy, có chỗ để xe fee.+ dọn vệ sinh hàng ngày, không gian sống sạch đẹp.+ tầng 1 có cửa hàng phu my mart nhanh rẻ, tiện lợi.+ gần: bến xe mỹ đình, svđ mỹ đình, đh quốc gia, đh thương mại.- qua trực tiếp xem và chọn .- liên hệ: em xuân 0987630866."
59,03/2021,2000000,18,20.967306317651108, 105.86929136894081,nhatang,6.10,130.63,khepkin,"Đường Tam Trinh, Phường Hoàng Văn Thụ, Quận Hoàng Mai, Hà Nội","chỉ 2tr có ngay  khép kín đủ đồ tại tam trinh, hoàng mai.  khép kín, có điều hòa, nóng lạnh, giường, quạt, bếp nhà không chung chủ, gần công viên yên sở, time city, metro, tân mai, đền lừ, vĩnh hưng, vĩnh hoàng, cạnh chợ, siêu thị, đượng rộng, ô tô đỗ cửa địa chỉ: số nhà 42 ngách 1 ngõ 989 tam trinh, hoàng mai, hà nội. (cổng khu tái định cư x2b, đối diện điện máy xanh 192 tam trinh)  18m2 giá 2tr/tháng.  như ảnh.  22m2 giá 2tr4 có cửa sổ thoáng mát, tủ quần áo️️️ lh chính chủ: (miễn quảng cáo)"
52,03/2021,2500000,23,21.041769468377325, 105.76029586317479,nhatang,2.46,18.2,khepkin,"Đường Cầu Diễn, Phường Cầu Diễn, Quận Nam Từ Liêm, Hà Nội","nhà 5 tầng mới xây đầu năm 2018. khu dân trí cao, an ninh cực tốt. không chung chủ,  khép kín, có kệ bếp trong ,lối đi riêng, có sân phơi đồ, an ninh tốt.gần siêu thị,  gym, công viên-  22m2 - 25m2.-  thoáng mát sạch sẽ, có cửa sổ, có chỗ để xe tầng 1. điện nước được tính theo đồng hồ riêng.- giá: 2.200.000đ/tháng.địa chỉ: số nhà 33, ngõ 29, đường cầu diễn (cạnh chợ cầu diễn).liên hệ: 0912. 939. 123 (chị nguyệt)"
58,03/2021,1000000,15,21.00150174707738, 105.85549557788875,nhacap,4.29,7.11,kkk,"Số 2 ngõ 221 Ngõ Quỳnh Đường Quỳnh Lôi, Phường Quỳnh Lôi, Quận Hai Bà Trưng, Hà Nội"," có nhà cấp 4 chia 3 . hiện đang dư 1 . chung nhà vệ sinh, nhà tắm. nhà vệ sinh và nhà tắm riêng. có sân chung.  như trên ảnh bản đồ. 1  có thể ở được tối đa 2 người.  thuận lợi, gần chợ, bệnh viện, trường học --> nhìn bản đồ sẽ rõ. ngay mặt ngõ đi vào nhà thứ 2 nên thuận lợi đi lại, không ngõ ngách."
53,03/2021,3000000,22,20.99288498823461, 105.83197552517314,nhatang,7.27,13.8,khepkin,"210 Phố Lê Trọng Tấn, Phường Khương Mai, Quận Thanh Xuân, Hà Nội","chính chủ cần   gần ngã tư sở.địa chỉ: 210 lê trọng tấn, thanh xuân, hà nội.nhà mặt ngõ rộng ô tô đỗ cửa, cách mặt đường lớn 100m.không chung chủ. : 20m2điện: 3,5k/số, nước: 70k/ng, wf: 100k/ đầy đủ giường, tủ, điều hòa, nóng lạnh. có ban công cửa sổ thoáng.giá từ 2.8tr - 3.8tr / thángliên hệ: 0918918527"
63,03/2021,2500000,25,20.991327918901796, 105.79580064307343,nhatang,8.41,4.12,khepkin,"205 Lương Thế Vinh, Phường Thanh Xuân Bắc, Quận Thanh Xuân, Hà Nội","+ điều hòa, nóng lạnh, quạt trần, tủ 3 cánh, giường 1,8-2m. ban công…+ máy giặt….+ cầu thang máy 50k/1 người, điện 3,5k/1 số, nước 25k/1m3 tất cả giá dân chính chủ .+ an ninh 24/24. có camera, hệ thống cửa vân tay.+ địa chỉ: số nhà 4 nghách 14 ngõ 83 tân triều, triều khúc, thanh xuân hà nội.+ địa chỉ: số nhà 4 nghách 20 ngõ 20 tân triều, triều khúc, thanh xuân hà nội.+ địa chỉ: số nhà 08 đường tân triều, triều khúc, thanh xuân hà nội.+ địa chỉ: số nhà 39 ngõ 205 lương thế vinh, thanh xuân hà nội.+ địa chỉ: số nhà 2 nghách 36 ngõ 236 khương đình, thanh xuân hà nội.+ giao thông thuận lợi, cáchliên hệ zalo: 0823263888 có ảnh và video cụ thể."
64,03/2021,1800000,22,20.9825452409551, 105.7702118558676,ccmn,4.32,11.21,khepkin,"Phố Vạn Phúc, Quận Hà Đông, Hà Nội","  mô hình chung cư mini:vệ sinh khép kín, có wifi, camera, có chỗ để xe miễn phí, truyền hình cáp, có bình nóng lạnh, điều hoà.địa chỉ: đại mỗ, từ liêm (gần ngã 4 tố hữu, vạn phúc)ưu tiên hộ gia đình ơn lâu dài.liên hệ : mr thắng sđt 0915310782, 0947975798 chủ nhà)ps: còn 1 :- 01   16m2, gác xép 6m2,"
61,03/2021,2200000,20,20.98200078991442, 105.8341278960172,cnmn,3.54,50.54,khepkin,"Đường Định Công, Phường Định Công, Quận Hoàng Mai, Hà Nội","  đủ đồ. giường,tủ, điều hoà,nóng lạnh, bàn phấn, máy giặt,tủ lạnh,bàn bếp,bàn ghế. điện 3.5k 1 số. tiền nước,mạng, dọn dẹp vệ sinh, phí chung cư là 200k. bạn nào có nhu cầu ở thì liên hệ  luôn theo số điện thoại để đến ở nhé"
62,03/2021,1499000,65,21.005529566687784, 105.80680887543947,nhatang,5.18,103.65,khepkin,"21 Đường Lê Văn Lương, Phường Nhân Chính, Quận Thanh Xuân, Hà Nội","cần tìm bạn ở ghép dạng homestay tại địa chỉ: ngõ 21 lê văn lương, nhân chính, thanh xuân, hn. cách đường hoàng ngân và bến xe bus nhanh 100m. cách tòa chung cư golden palm và star city 50m.(tìm kiếm trên maps không ra ngõ 21 lê văn lương thì bấm vào link này: https://goo.gl/maps/jznnjyqygnm2)- phù hợp với các bạn sinh viên, người mới đi làm vui vẻ hòa đồng.không gian hiện đại, đầy đủ tiện nghi, môi trường sống dân trí cao, tiện đi lại bằng tất cả các phương tiện như: xe máy, taxi, bus nhanh, bus.quan trọng nhất là không phát sinh chi phí.-  nnam 4 giường tầng giá 1,5 triệu/người/tháng.(hợp đồng ngắn hạn 1,6tr/tháng)-  nữ 3 giường tầng giá 1,6 triệu/người/tháng.(hợp đồng ngắn hạn 1,7tr/tháng)miễn phí: điện, nước sạch, mạng internet, gas, có người dọn tổng vệ sinh hàng tuần.mỗi  có từ 4 - 6 người tại khu đô thị cao cấp đảm bảo an ninh, sạch sẽ, thuận tiện giao thông, đầy đủ tiện nghi chỉ việc xách quần áo đến ở.mỗi người có 2 tủ quần áo có khóa riêng.chăn ga gối đệm đầy đủ cho từng người.bếp, tủ bếp, nồi niêu bát đĩa, dao, thớt, bàn ăn.tivi truyền hình cáp riêng từng , tủ lạnh, 2 máy giặt, bình nóng lạnh, điều hòa.các bạn quan tâm vui lòng liên hệ chính chủ để đi xem nhà.nói không với thu phí đi xem hay thuê.lh: 0901498666 (fb, zalo, viber, imessage)."
65,03/2021,3250000,26,20.986745930763473, 105.81396692132881,nhatang,5.11,13.37,khepkin,"Phố Vũ Tông Phan, Phường Khương Đình, Quận Thanh Xuân, Hà Nội","- địa chỉ: nhà số 5, ngõ 481 vũ tông phan, quận thanh xuân.- còn chỗ cho cả nam & nữ-  thiết kế dạng homestay, 1  full là 6 giường. mỗi  đều có điều hòa, nóng lạnh, tủ giầy, kệ đồ, tủ quần áo ( mỗi người 1 tủ,1 bộ giường - chăn ga gối đệm riêng )- các tiện ích đi kèm: máy giặt, wifi, tủ lạnh, bàn ăn, tủ bếp ( đầy đủ xoong, nồi, chảo, bát đĩa,…)- giờ giấc đi lại tự do, phần lớn người ở là các bạn trẻ đang đi làm, lịch sự, thân thiện, hòa đồng.- điện nước giá dân, rất hợp lý. hàng tuần có người vệ sinh.- giá 1,25tr/ ngườiđt/zalo 0902 206 416 [ gặp hiển ]"
67,03/2021,3000000,20,20.981383465255373, 105.78879432315443,nhatang,9.15,22.14,khepkin,"55 Đường Trần Phú, Phường Văn Quán, Quận Hà Đông, Hà Nội","- nhà đẹp full nội thất - chỉ việc mang vali vào ở.-  đẹp,sạch sẽ thoáng mát gần các trường đh : spnt trung uơngcngtvt,kiến trúc,bưu chính,đh hà nội,...- giá 2.8tr-3tr-3tr2/tháng. đóng 1 cọc 1 tháng (ở được luôn).- thang máy tốc độ caomô tả chung.- full nội thất điều hòa, nóng lạnh,tủ lạnh,giường, tủ, phơi đồ,bàn học ,để xe miễn phí, camera an ninh, máy giặt chung, kệ bếp.- chính chủ miễn môi giới.- điện 3,5k/ số.- nước 25k/số.- hàng tuần có người qua dọn vệ sinh chung cả nhà thường xuyên.- không ở chung chủ. giờ giấc đi lại thoải mái, tiếp bạn bè vô tư miễn là lịch sự - hợp đồng lâu dài không tăng giá, chu kỳ đóng tiền nhà 1 tháng 1 lần, đặt cọc 1 tháng tiền nhà"
66,03/2021,2300000,14,20.97785100100932, 105.79749961761932,nhatang,5.63,14.68,kkk,"26 NGÕ 241 Đường Chiến Thắng, Phường Văn Quán, Quận Hà Đông, Hà Nội","- còn 1  tầng 2 giá 2tr3, 2  chung 1 nhà vệ sinh- ở được luôn.- ngõ rộng ô tô đỗ cửa- nội thất điều hòa, nóng lạnh,, giường,tủ, phơi đồ, bàn, để xe miễn phí, camera an ninh, máy giặt- thanh toán cọc 1 đóng 1mô tả chung- máy giặt dùng chung miễn phí- chính chủ miễn môi giới- điện 3,5k/ số- nước 80k/ người.- hàng tuần có người qua dọn vệ sinh chung cả nhà thường xuyên.- không ở chung chủ. giờ giấc đi lại thoải mái, tiếp bạn bè vô tư miễn là lịch sự - hợp đồng lâu dài không tăng giá, chu kỳ đóng tiền nhà 1 tháng 1 lần, đặt cọc 1 tháng tiền nhà"
68,03/2021,1000000,10,21.031349933532876, 105.79479566056325,nhacap,6.7,202.32,kkk,"Phường Dịch Vọng, Quận Cầu Giấy, Hà Nội","  không khép kíntiền thuê 1 triệu/tháng 10m2.nhà vệ sinh, nhà tắm dùng chung.có sẵn wifi, tiền wifi 50000đ / người/ tháng.tiền nước 60000đ/ người/ tháng, tiền điện 3500đ/số. tối đa  được 2 người ở chung, chỉ có chỗ để được 1 xe máy.giờ đóng cửa: 22h30'.liên hệ: 0336519682. ( nên liên hệ với số trong phần mô tả)địa chỉ cụ thể: số 12, tổ 29, ngách 37/21, ngõ 37 dịch vọng, cầu giấy, hà nội."
60,03/2021,3000000,22,20.963724856928362, 105.7634570699335,nhatang,5.79,38.23,khepkin,"Phố Lê Trọng Tấn, Phường La Khê, Quận Hà Đông, Hà Nội","chào cả nhà, hiện gia đình em/ đang có nhu cầu  nhà tại quận hà đông, ngõ 4 đường lê trọng tấn.nhà vừa mới xây mới, chưa ai ở lần nào, có trần thạch cao với đèn spot, rất hiện đại, mỗi tầng đều nhà vệ sinh khép kín và bình nóng lạnh, wifi đầy đủ, cực kỳ an toàn với cửa cuốn ở tầng 1, cộng thêm các loại cửa mỗi tầng, , có em gái  đang ở tầng 2, cũng mới chuyển vào thôi ạ. thông tin nhà như sau ạ:- tầng 4: 22m2. có sẵn bình nóng lạnh, có ban công nấu ăn, chỗ để máy giặt, nhà vệ sinh khép kín. giá : 3 triệu đồng/tháng, chưa tính tiền điện nước- tầng 5:  trên cùng, 13m2, nhà vệ sinh khép kín, bình nóng lạnh, hơi bé tuy nhiên ban công rất rộng, và phù hợp với bạn nào thích trồng rau và cây trên sân thượng, , tuy nhiên ko bắt buộc phải trồng ạ, . giá : 2 triệu đồng/tháng- tầng 1 thì  đang tìm  văn  nhỏ (khoảng 20m2) vì mặt tiền rất đẹp, cả mặt tiền đều là cửa kính và có bậc thang đi lên, ai có nhu cầu thì cũng liên hệ nhé. giá : 3 triệu đồng/tháng- tầng trệt là chỗ để xe máy, chắc cũng để đc kha khá nếu biết cách xếp.nhà ở ngõ 4, đường lê trọng tấn, ngay đầu ngõ đi qua đường mấy bước là vinmart và bể bơi , cách chợ hà đông khoảng 2km, cách học viện bưu chính khoảng 3km.ai có nhu cầu hoặc câu hỏi thì inbox hoặc gọi điện cho  nhé. nếu muốn đến xem thì  sẽ sắp xếp . cảm ơn cả nhà nhé!"
69,03/2021,1700000,17,21.052164041930798, 105.87028182186587,nhatang,4.97,605.23,khepkin,"150 ngõ 264 Ngọc Thụy, Phường Ngọc Thụy, Quận Long Biên, Hà Nội","  tầng 3 cực đẹp tại 150/264 ngọc thụy cực đẹp, ban công cực rộng và thoáng,  vệ sinh ở ngay ngoài cửa, đã có đệm, tủ, bàn trang điếm. điện nước mạng tính giá dân.nhà cực kì gần chợ, gần vườn hoa và công viên. đi sang trung tâm hà nội chỉ 15 phút.đặc biệt giá nhà chỉ 1,7 triệu. có thể ở 2-3 người mà không thêm tiền.p/s:  chỉ còn 1 , nên sẽ ưu tiên bạn nào gọi điện và đến xem  trước nhéai có nhu cầu liên hệ trực tiếp  không qua môi giới0966.026.896 ( a diễn )thank all ️"
72,03/2021,2800000,25,20.98316146132742, 105.80080358104179,ccmn,5.49,8.23,khepkin,"111 Đường Triều Khúc, Phường Thanh Xuân Nam, Quận Thanh Xuân, Hà Nội","chung cư mini 111 triều khúc - gần đh công nghệ gtvtnhà thiết kế 5 tầng, các căn hộ khép kín, nội thất đầy đủcó 2 loại căn hộ chính* loại 1: căn hộ 1 ngủ, rộng 20m2, của sổ nhỏ: giá 2tr8-3tr* loại 2: căn hộ 1 ngủ, rộng 25m2, có cửa sổ to: giá 3tr3-3tr5mô tả chung* camer an ninh, khóa cổng kiểm soát vân tay* thiết kế: khu bếp, vệ sinh khép kín* nội thất: điều hòa, nóng lạnh, máy giặt, tủ lạnh, giường ngủ, tủ quần áo, bàn bếp, bàn làm việc, đệm…* vệ sinh dọn dẹp hàng tuần* điện 3,5k/số ; nước 20k/khối* hợp đồng dài hạn không tăng giá, giờ giấc thoải mái, tiếp bạn bè lịch sự thoải mái* chính chủ, miễn trung gian* nhắn zalo khi cần thông tin chi tiết"
73,03/2021,2400000,20,20.968741059024484, 105.78678202759754,nhatang,9.98,38.04,khepkin,"207 Phố Phùng Hưng, Phường Phúc La, Quận Hà Đông, Hà Nội","207 phùng hưng-văn quán-cạnh bệnh viện 103-cạnh chợ-full nội thấtnhà thiết kế 5 tầng, nội thất đầy đủcó 3 loại căn hộ chính* loại 1: căn hộ 1 ngủ, wc 2  chung 1, rộng 18m2, của sổ nhỏ: giá 2tr2-2tr3* loại 2: căn hộ 1 ngủ, wc 2  chung 1 rộng 22m2, có cửa sổ to: giá 2tr4-2tr5* loại 3: căn hộ 1 ngủ 1 bếp, wc khép kín, rộng 40m2, cửa sổ to: giá 3trmô tả chung* camer an ninh, khóa cổng kiểm soát vân tay* thiết kế: khu bếp, vệ sinh khép kín* nội thất: điều hòa, nóng lạnh, máy giặt, tủ lạnh, giường ngủ, tủ quần áo, bàn bếp, bàn làm việc, đệm…* vệ sinh dọn dẹp hàng tuần* điện 3,5k/số ; nước 80k/người* hợp đồng dài hạn không tăng giá, giờ giấc thoải mái, tiếp bạn bè lịch sự thoải mái* chính chủ, miễn trung gian* nhắn zalo khi cần thông tin chi tiết"
75,03/2021,3500000,36,21.037436981437857, 105.79908462864827,ccmn,6.48,247.43,khepkin,"Đường Dương Quảng Hàm, Phường Quan Hoa, Quận Cầu Giấy, Hà Nội","chính chủ   kiểu chung cư mini khép kín 36m2 nhà đẹp, tiện nghi, tự do, yên tĩnh, thoáng mát, ngõ 165, đường dương quảng hàm, cầu giấy, hà nội.bạn đang mong muốn sống trong 1 căn  thoáng đẹp khép kín của chung cư mini tiện nghi, thoải mái, yên tĩnh, thoáng mát, tự do giờ giấc như chính nhà của ? bạn đang mong muốn thuê căn  giá cả hợp lý mà lại rất chất lượng?hiện tại  đang có  trống tại quận cầu giấy  trung tâm thành phố rất thuận tiện đi lại và sinh hoạt.- địa chỉ: số nhà 14, ngách 40, ngõ 165, đường dương quảng hàm, phường quan hoa, quận cầu giấy, hà nội (gần đại học thủ đô)- : trung tâm quận cầu giấy nên di chuyển cực kỳ thuận tiện qua các quận khác.+ nhà gần cầu giấy, gần chợ quan hoa, gần siêu thị vinmart, lottemart, gần nhiều cửa hàng quán ăn, gần bến xe bus; gần trường mầm non; gần trường học cấp 1, cấp 2, cấp 3; gần nhiều trường đại học như đại học thủ đô, đh giao thông vận tải, đh ngoại thương, đh luật, đh quốc gia, đh sư phạm, hv báo chí, đại học điện lực, hv kỹ thuật quân sự….+ xung quanh có nhiều ngân hàng lớn như vietcombank, viettinbank, bidv, techcombank, mb….+ nhà gần cầu giấy chỉ mất 2 phút đi xe, cách lottemart 5 phút đi xe, cách công viên nghĩa đô 5 phút đi bộ; cách phố quan hoa, đường cầu giấy 200m; cách đường nguyễn văn huyên, nguyễn khánh toàn 50m….- tiện ích trong 1  khép kín đầy đủ gồm:+ điều hòa,+ giường cho bạn giấc ngủ ngon.+ tủ áo quần cho bạn gọn gàng ngăn nắp trong căn  của .+ nóng lạnh an toàn chống giật.+ khu vệ sinh khép kín, riêng biệt có đầy đủ thiết bị vệ sinh cho bạn riêng tư, kín đáo, sạch sẽ.+ khu bếp nấu ăn riêng biệt không lo ám mùi vào  rất thuận tiện cho việc nấu ăn.+ có chỗ để đồ riêng rộng rãi, gọn gàng cho căn  thêm rộng rãi.+ có cửa sổ thoáng mát ngập tràn ánh sáng tự nhiên+ ban công để máy giặt phơi đồ thoáng rộng riêng biệt với  ngủ.- internet tốc độ cao, có công tơ điện nước riêng từng .- nhà có chỗ để xe ở tầng 1 rộng rãi miễn phí- giờ giấc thoải mái không chung chủ. có khóa vân tay, khóa cơ, camera an ninh an toàn cho tài sản của bạn.- không gian sống thoáng mát, yên tĩnh, sạch sẽ, có vệ sinh lau dọn hàng tuần.-  rộng: 36m2- giá: 3.5tr- liên hệ: mr lực: 0961.529.365 (chính chủ không qua môi giới) đẹp  vừa mới trống hãy liên hệ ngay để hẹn giờ xem  trước khi đến kẻo hết. chắc chắn bạn sẽ hài lòng với sự lựa chọn của . (đảm bảo bạn xem là thích)(ưu tiên hộ gia đình; các bạn sinh viên ở sạch sẽ; người đi làm tử tế, lịch sự, ở lâu dài)"
76,03/2021,2200000,20,21.027677781283746, 105.8009117301445,nhatang,5.26,90.23,khepkin,"Đường Láng, Phường Láng Thượng, Quận Đống Đa, Hà Nội","có   ưu tiên người đi làm, hộ gia đình, có gác xép không chung chủ , đi về tự do, không bị phụ thuộc , có sân rộng giá cả : theo thoả thuận liên hệ ông trững : 0971.139.742"
78,03/2021,2200000,22,21.063421133756805, 105.83160808178982,nhatang,4.11,10.23,khepkin,"12A, Ngõ 119 Âu Cơ, Phường Yên Phụ, Quận Tây Hồ, Hà Nội"," đang tìm 1 đồng đội về ở cùng nhà (ở 1  riêng nha)#  tầng 5 (trong nhà 5 tầng + tầng 6 là sân thượng), không chung chủ.# trong  có: giường lớn 1m8x2m; tủ quần áo 3 ngăn, điều hoà, ghế.# cửa sổ lớn, ánh sáng tự nhiên tràn ngập, buổi tối mở cửa ra là mát rười rượi.# tiện nghi trong nhà: máy giặt, tủ lạnh, nóng lạnh, bếp nấu ăn, máy lọc nước, sân thượng phơi quần áo thoáng mát, cầu thang rộng.# vệ sinh chung với tầng 4 có 1   thôi.# điện nước giá dân, mọi người trong nhà tự chia nhau nên rẻ lắm.# mọi người trong nhà đều đi làm và đều rất có ý thức giữ gìn vệ sinh chung.liên hệ  là thanh - zalo: 0944633680"
77,03/2021,3400000,15,21.020763494796196, 105.83096115544308,nhatang,7.02,5.23,khepkin,"248A Tôn Đức Thắng, Quận Đống Đa, Hà Nội"," khép kín mặt phố tôn đức thắng???? địa chỉ: 248a tôn đức thắng - đống đa nội thất: quạt trần, giường tủ, điều hoà, nóng lạnh, chậu rửa bát, máy giặt chung. : 19m² có ban công️ free: để xe, wifi, nước lọc ro️ giá: 3,x tr/tháng call: 0929090000 ( mr duy ).p/s: add zalo  gửi video"
74,03/2021,3000000,25,20.993431071745803, 105.83171443320926,nhatang,8.25,13.2,khepkin,"208 Lê Trọng Tấn, Phường Khương Mai, Quận Thanh Xuân, Hà Nội","  (riêng chủ) tại 208 lê trọng tấn, thanh xuân ( cách đại học y hà nội 500m )hiện nhà  còn  vào ở luôn???? riêng chủ, giờ giấc đi lại thoải mái.-  đẹp  18m2 - 30m2 (ở đc 2 người trở len ) có đầy đủ nóng lạnh, điều hòa, giường, máy giặt- vệ sinh khép kín, sạch sẽ, điện nước có công tơ riêng.- chỗ để xe và các tầng có camera bảo vệ 24/24 yên tâm an ninh.- giá pong trung bình 3trđiện nước 3.5k/1 số, nước 70k/1 ngườiđịa chỉ: số nhà 03 ngõ 208 đường lê trọng tấn, thanh xuân, hà nộinhà chính chủ không qua môi giới(liên hệ chủ nhà): chị hoà- 0921.597.888"
79,03/2021,2700000,19,20.983194445118556, 105.8008031630808,ccmn,6.32,11.21,khepkin,"111 Triều Khúc, Phường Thanh Xuân Nam, Quận Thanh Xuân, Hà Nội"," ccmn khép kín đủ đồ mới 100% dt: 18 giá từ 2.7tr, triều khúc tt,thanh xuân,hnchính chủ   kiểu chung cư mi ni khép kín mới 100%,nhà chính chủ không qua môi giới. ( bếp, vệ sinh,  ngủ riêng biệt)+,  đẹp có 2 loại  18m2 chỉ 2.7 tr đủ đồ- ,điều hòa , nóng lạnh, giường , tủ quần áo , bàn bếp, chậu rửa, có camera yên tâm an ninh,khóa vân tay.+, giờ giấc thoải mái.+, miễn phí chỗ để xe rộng rãi không sợ trầy xước xe đẹp.+,điện 3,5k/kw+, nước 25k/m3+, giếng trời mát mẻ, ban công thoáng gió+, chỗ nấu ăn riêng biệt thuận tiện không ám mùi vào . đảm bảo xem là thích.+, vệ sinh khép kín, sạch sẽ đã trang bị các thiết bị hiện đại: vòi hoa sen, gương, bệt, chậu rửa, bình nóng lạnh.+, không gian chung yên tĩnh sạch sẽ, có vệ sinh lau dọn hàng tuần.+, internet cáp quang tốc độ cao, điện nước công tơ riêng.+, gần chợ tân triều trung tâm đi lại thuận tiện.+, giao thông đi lại thuận tiện ,địa điểm đẹp gần đh công nghệ giao thông vận tải, hv kỹ thuật mật mã, đh hà nội, hv khoa học xã hội, học viện an ninh nhân dân, đại học hà nội, đại học công đoàn,hv bưu chính viễn thông, kiến trúc..+ đi ra đường nguyễn xiển 360m( ngõ 300) ,ra nguyễn trãi 550m.+,địa chỉ: số 42 ngõ 111 triều triều khúc thanh trì hà nội.+,nhà chính chủ không qua môi giới. liên hệ xem nhà mr thuận 0904 815 983"
71,03/2021,3000000,30,21.02410812292386, 105.81210693210053,nhatang,6.42,53.34,khepkin,"17 ngõ 7 Nguyên Hồng, Phường Thành Công, Quận Ba Đình, Hà Nội","nhà mk cho nữ thuê  địa chỉ 17 ngõ 7 nguyên hồng, hà nội, an ninh tốt, đầy đủ bếp, điều hòa, tủ lạnh, nhà vệ sinh riêng, có ban công thoáng mát.các bạn có thể đến xem  thoải mái. mọi thắc mắc liên hệ số đt 0387292860 (cô hạnh ) để biết thêm chi tiết. mk cảm ơn."
70,03/2021,3000000,30,21.00323204965489, 105.82473283629285,nhatang,6.77,43.65,khepkin,"Số nhà 55 ngõ 165 Phố Khương Thượng, Phường Khương Thượng, Quận Đống Đa, Hà Nội","  ở phường khương thượng, quận đống đa, hà nộiđịa chỉ: 55 ngõ 165 phường khương thượng, đống đa, hà nội tầng 1, khoảng hơn 30m2, có gác xép rộng 15m2 , nhà bếp và  tắm khép kín, có bình nóng lạnh.(nhà 3 tầng, cầu thang đi lên tầng riêng, không đi qua  tầng 1)có sân để xe và phơi quần áo, có công tơ điện riêng. nước 50k/ng, điện 4k/số.vừa mới tân trang lại, sạch sẽ, thoáng mát, yên tĩnh, riêng biệt không phải chung đụng với ai, đảm bảo an ninh.gần trường học (cấp 1, 2, 3 và đại học), gần chợ (nhưng không ở sát chợ nên rất yên tĩnh), gần các trung tâm thương mại (royal city, mipec tower,…)giá: 3.000.000vnđ.mọi chi tiết liên hệ: cô châu: 0393687686.p/s: ưu tiên cho hộ gia đình và người đã đi làm thuê."
