stt,thoigian,giaphong,dientich,vido,kinhdo,khutro,drmd,kcdc,khepkin,tiennghi,thuantien,diachi,chitiet
185,12/2020,2000000,15,21.0048198,105.8723742,"Đường Bạch Đằng, Phường Thanh Lương, Quận Hai Bà Trưng, Hà Nội"," 1  khép kín giá rẻđiện nước riêng, vệ sinh riêng rộng 15m2 đầy đủ tiện nghigiờ giấc đi lại thoải mái"
189,12/2020,3800000,35,20.9825628,105.7700854,"28/8 Đường Đại Linh, Phường Trung Văn, Quận Nam Từ Liêm, Hà Nội","chính chủ  căn hộ mini ở ngôi nhà được thiết kế hiện đại có thang máy, có khu nấu ăn riêng biệt,  có cửa sổ, ban công, giếng trời rất thoáng mát.* : số 6 ngõ 28/8, phố đại linh, đường lê văn lương, trung văn - hà nội. ngôi nhà cách đường ô tô chỉ 20m, cách bãi gửi ô tô 100m, cách chung cư vinaconex 3 chỉ 300m, cách đường lê văn lương 500m, xung quanh tòa nhà có rất nhiều quán cafe, quán ăn, nhà hàng và nhiều tiện ích nữa.* về tòa nhà: có cầu thang máy đi lên các tầng, có hệ thống chữa cháy hiện đại, có camera giám sát, có khóa vân tay chỉ người thuê mới ra vào được.+ tầng 1: nhà để xe và 01  .+ tầng 2 đến tầng 5: mỗi tầng bố trí 2 căn hộ khép kín.*  : 40m2 thiết kế 01  khách và 01  ngủ.* nội thất: điều hòa, giường, tủ, nóng lạnh, tủ bếp.* giá : 3.8tr - 4.2 triệu /tháng.liên hệ: 0868.790.832ưu tiên hộ gia đình ở lâu dài và tử tế."
187,12/2020,2500000,22,21.077288,105.7738373,"số 8 TT hóa chất Đường Cầu Vồng, Phường Đức Thắng, Quận Nam Từ Liêm, Hà Nội","nhà 05 tầng có    20-25 m2.  thông thoáng, có lan can .điện nước đầy đủ, vệ sinh khép kín. có bếp nấu ăn. đã trang bị wife, máy lọc nước, camera an ninh, máy điều hòa, bình nóng lanh. công tơ điện , nước riêng từng . khu vực an có an ninh tốt."
188,12/2020,2000000,15,20.9751096,105.8690534,"Nhà vườn 1.1.27 (nhà liền kề) ở gần gelexia Riverside 885 Tam Trinh Đường Nguyễn Tam Trinh, Phường Yên Sở, Quận Hoàng Mai, Hà Nội"," giá 2 triệu/ thángbên  đang còn 1  giá 2 triệu như ảnh tại tầng 5, nhà vườn 1.1.27 (nhà liền kề) ở gần gelexia riverside 885 tam trinh.- phù hợp cho người đi làm hoặc sinh viên ở.- nhà vệ sinh dùng chung ở tầng 4, có nóng lạnhcó thể ở ngay. i hệt ảnh, đóng tiền 1 tháng 1, cọc 1 thángbạn nào có nhu cầu, liên hệ: chung 0917 79 1186 (zalo số: 0868 0202 08)"
182,12/2020,3000000,30,21.0875176,105.8096313,"60 phố Phú Thượng Đường An Dương Vương, Phường Phú Thượng, Quận Tây Hồ, Hà Nội"," 2  cạnh nhau,  12m2 và 18m2, công trình phụ khép kín trong từng . phù hợp với gia đình.mỗi  đều có sẵn điều hoà, nóng lạnh.khu vực an ninh đảm bảo, có camera. cầu thang chung.chi tiết liên hệ cô vân - 0983712366"
196,12/2020,5500000,30,21.0145619,105.8403657,"45 Đường Hồ Ba Mẫu, Phường Trung Phụng, Quận Đống Đa, Hà Nội","-  toà căn 28m2/căn trong tòa nhà 8 căn hộ riêng biệt, có thang máy. mỗi căn đc trang bị đầy đủ từ bát đĩa, bếp từ, nồi chảo, chăn ga gối đệm đến đồ điện tv, tủ lạnh, điều hoà, nóng lạnh, máy giặt. chỉ việc xách vali đến và ở- nhà trong ngõ nông, cách mặt hồ 30m, 2 xe máy tránh nhau, bãi ô tô gửi cách nhà 100m.- ở tối đa 4 người (có đệm dự )- được phép nuôi động vật- phơi đồ ngoài ban công từng , có máy giặt riêng- thanh toán linh động 3 cọc 1 hoặc 1 cọc 1- miễn phí: dịch vụ vệ sinh , thay ga gối hàng tuần, wifi, th cap, gửi xe và sử dụng thang máy, vệ sinh môi trường"
190,12/2020,1000000,11,21.0057491,105.8225012,"Đường Tây Sơn, Phường Ngã Tư Sở, Quận Đống Đa, Hà Nội","nhà riêng nên giờ giấc không phụ thuộc vào chủ nhà.công trình phụ khép kín, thích hợp cho 1 người ở.điện nước có đồng hồ riêng, tính theo hóa đơn của chủ nhà.ăn ở đi lại rất thuận tiện."
191,12/2020,2000000,32,20.9315381,105.8260943,"Xã Vĩnh Quỳnh, Huyện Thanh Trì, Hà Nội","chính chủ  nhà c4  32m2 khép kín, thoáng mát - tập thể kho trung tâm (cạnh trường quản lý cán bộ nông nghiệp & ptnt – xã vĩnh quỳnh, thanh trì, hà nội). đường ngõ rộng, ô tô 4 chỗ vào tận cửa, thuận tiện đi lại. điện, nước đầy đủ theo giá qui định của nhà nước. khu vực an ninh tốt, hàng xóm thân thiện.liên hệ: chị hằng 0912.06.98.77"
199,12/2020,2500000,20,20.9625316,105.8399127,"Đường Bằng A, Phường Hoàng Liệt, Quận Hoàng Mai, Hà Nội","  chung cư miniđịa chỉ: đầu ngõ 109 bằng liệt (cách kđt linh đàm 600m)  : 20m2 - 27m2 giá thuê từ 2tr5 - 2tr8 - 3tr điểm cộng:- khép kín, thang máy- ban công cửa sổ, khu bếp tách biệt- trang bị đầy đủ tiện nghi- sạch sẽ thoáng mát, an ninh tốt- để xe rộng rãi free, ô tô đậu cửa nhà- giờ giấc tự do. chi phí khác:- điện 3,5k - nước 25k - wifi 100k/- máy giặt chung 80k/người- thang máy 50/người. bạn cần tư vấn?hotline/zalo: 0389 172 358"
198,12/2020,2500000,40,20.9624598,105.7946736,"136 Đường Mậu Lương, Phường Kiến Hưng, Quận Hà Đông, Hà Nội",": 40m²giá : 2.5 triệu/tháng0976789417thông tin mô tả lại nguyên tầng 3  40m2 số nhà 136 mậu lương kiến hưng ,hà đôngnhà  nhu cầu sử dụng không hết  lại nguyên tầng 3  40m2-  có cửa sổ rộng thoáng mát- 1 nhà vệ sinh đầy đủ vòi hoa sen bồn bệt.- có khu để bếp nâu ăn không trong - tầng 1 để xe- cửa ra vào xếp cuốn- có 1  rộng trên tầng 4 để đồ thừa không dùng đến.- phơi quần áo trên tầng 4--->>> phù hợp với hộ gia đìnhnhà  có 2 vợ chồng và 1 con nhỏ nên cũng muốn ở cùng hộ gia đình. tiêu chí: sạch sẽ, không hút thuốc lá vì có con nhỏ. giá  cả tầng 3 là 2.500.000. điện 3k 1 số. nước tính theo giá nhà nước cuối tháng có hóa đơn chia đầu người. đến xem  là ưng ngay. khu nhà có vụ trí thuận lợi: gần chợ gần bến xe"
193,12/2020,5500000,35,21.0122717,105.8074435,"6 Phố Nguyễn Ngọc Vũ, Phường Trung Hòa, Quận Cầu Giấy, Hà Nội","  cc mini, không chung chủ- : 35m2- nội thất: nóng lạnh, điều hòa, máy giặt, tủ lạnh, giường + tủ, bàn trà, bệ bếp, tủ bếp đầy đủ.- giờ giấc tự do, khóa vân tay, camera an ninh 24/24* địa chỉ: số 6a ngõ 219/75 nguyễn ngọc vũ (thông ngõ 23 nguyễn thị định)------------------------------------------------liên hệ trực tiếp: 0971.526.777 - 0905.408.669"
194,12/2020,6800000,60,21.0085402,105.8076912,"148/90 Đường Hoàng Ngân, Phường Trung Hòa, Quận Cầu Giấy, Hà Nội"," căn hộ mini ngõ 90 hoàng ngân, trung hòa, cầu giấy, hà nội.: 60m2, 1  ngủ, 1  khách , 1 nhà vệ sinhđủ nội thất từ sofa, giường ngủ, bàn ăn, tủ quần áo, bếp, tủ bếp, điều hòa, ti vi, tủ lạnh, sofa, máy giặt – tủ lạnh... chỉ cần xách vali đến ở.- thích hợp với hộ gia đình, sinh viên ở nhóm, hay người đi làm.giá thuê 6.8 triệu/tháng.. full nội thất-liên hệ chủ nhà: a khánh 0931526777"
192,12/2020,2000000,25,21.0383644,105.8060913,"Đường Bờ Sông, Phường Quan Hoa, Quận Cầu Giấy, Hà Nội","  khép kín tại địa chỉ số nhà 5, ngách 15, ngõ 59 phố quan hoa, cầu giấy, hn. nằm trong khu vực thuận tiện cho sinh hoạt, học tập và làm việc. không gian yên tĩnh, an ninh đảm bảo, có camera giám sát. tiện ích gồm: nhà xe miễn phí, internet tốc độ cao, bình nước nóng, điều hòa. trong  không có nội thất. liên hệ cô điệp 082 280 3167 để xem  cụ thể."
201,12/2020,1600000,120,21.0435607,105.8150934,"đường Thụy Khuê, Phường Bưởi, Quận Tây Hồ, Hà Nội","  kiểu co-living homestay ngay 429 thuỵ khuê (gần chợ bưởi) tiện cho các bạn làm ở lạc long quân, võ chí công, hoàng hoa thám, đội cấn, trúc bạch,  có  30m2 khép kín, một  có 2-3 giường tầng. mỗi khách thuê có tủ quần áo riêng, chăn ga gối đệm, điều hoà tủ lạnh nóng lạnh máy giặt. không gian sinh hoạt chung tầng 5 cực chill. có chỗ học tập, làm việc riêng. dọn dẹp vệ sinh 3 lần/tuần.nhà  ngay gần chợ bưởi, nhiều quán xá hàng ăn, siêu thị, cách hồ tây 5p đi bộ. cách bệnh viện thu cúc 3p đi bộ, rất tiện đi làm.giá thuê trọn gói cam kết không phát sinh thêm tiền điện nước internet.ngoài ra gần đó,  có căn ở nguyễn đình hoàn, cũng rất tiện cho các bạn làm khu vực hoàng quốc việt, lạc long quân, ngoại giao đoàn. bạn có thể tham khảo cả 02 căn."
206,12/2020,5000000,35,21.0182069,105.7792653,"50 Phố Đình Thôn, Phường Mỹ Đình 1, Quận Nam Từ Liêm, Hà Nội"," chung cư mini tại ngõ 50 đình thôn, không chung chủ, rộng rãi  35m2, thiết kế thông thoáng, tiện ích đầy đủ, dịch vụ không thiếu thứ gì. đầy đủ đồ đạc: giường đôi, tủ đứng, tủ bếp, điều hòa, nóng lạnh,máy giặt, bàn ghế (chuẩn như hình).không gian  yên tĩnh, vệ sinh định kỳ hàng tuần. internet tốc độ cao kết nối từng .nằm trong khu giao thông thuân tiện trục đường vành đai 3, tiện thường thông các ngả bắc nam, đông tây của hà nội.nhà nằm ngay mặt đường đình thôn, gần trung tâm thương mại big c garden, keangnam, các đường lớn như phạm hùng, trần duy hưng, cầu giấy, lê đức thọ, hồ tùng mậu, gần bến xe mỹ đình. đẹp, giá thuê từ 05 triệu, rất phù hợp với các bạn đi làm hoặc hộ gia đình ưa thích sống trong môi trường văn minh – sạch sẽ - kết nối mọi người- yêu môi trường xanhbạn nào có nhu cầu liên hệ: 0904.913.702 (anh việt) /0901.201.339 (anh chiến)/ 0916624886 - chị ngọc (không tiếp trung gian, mô giới, quảng cáo)xem nhà miễn phí, 24/24"
204,12/2020,1650000,120,21.018517,105.7928367,"Phố Trung Kính, Phường Yên Hòa, Quận Cầu Giấy, Hà Nội","giá chỉ từ 1650k mà được free điện nước internet (cam kết không phát sinh).  theo mô hình co-living. mỗi người có giường tầng và tủ quần áo riêng. được trang bị đầy đủ trang thiết bị như (tủ lạnh, máy giặt, lò vi sóng, bếp, nồi cơm điện, điều hoà)ngoài ra, còn có đội ngũ dọn dẹp vệ sinh chuyên nghiệp. dọn dẹp 3 lần/tuần.giờ giấc tự do thoải mái. gần các tuyến đường lớn: trung kính, dương đình nghệ, trần thái tông, công viên cầu giấy. rất phù hợp với người đi làm ở keangnam, các trường đại học thủ đô, sư phạm, quốc gia. cách bến mỹ đình 1km."
205,12/2020,3500000,25,20.9690164,105.781294,"Phố Bà Triệu, Phường Nguyễn Trãi, Quận Hà Đông, Hà Nội","- chính chủ không mất phí- đầy đủ nội thất, giường, tủ lanh, bàn làm việc,..-vệ sinh khép kín, có điều hòa, bình nóng lạnh,…-có máy giặt riêng từng , có ban công-không chung chủ, giờ giấc tự do, thoải mái.-có camera an ninh, cổng vân tay, thang máy.(gần sân vận động hà đông, gần chợ hà đông, viện 103 ...)"
200,12/2020,1700000,120,21.018517,105.7928367,"Phố Trung Kính, Phường Yên Hòa, Quận Cầu Giấy, Hà Nội","hệ thống tre home ra mắt 03 cơ sở mới quanh khu trung kính, duy tân, dịch vọng (phường yên hoà, q. cầu giấy) cho các bạn đi làm quanh keangnam, trần kim xuyến, trần thái tông có những sự lựa chọn khác nhau.>> nếu bạn thích chung cư chanh sả, một bước ra phố trung kính, tầng 2 là tập gym, tầng thượng là bể bơi thì hãy đến cơ sở 33 mạc thái tổ (chung cư thăng long tower)>> nếu bạn thích một bước xuống chợ, xung quanh là hàng trăm quán xá, cửa hàng thì hãy đến với cơ sở 78 duy tân (thông cả ngõ 133 xuân thuỷ và trần quốc vượng)>> nếu bạn thích ngay gần công viên để tập thể dục, hoặc bầu không khí trong lành thì hãy đến với cơ sở 99 thành thái (chung cư n09-b1)tất cả các cơ sở của tre home đều tuân thủ nghiêm ngặt các tiêu chuẩn bất biến như:* giá thuê là trọn gói. khách không lo phát sinh thêm các chi phí như điện nước internet dọn vệ sinh.* không chung chủ, giờ giấc tự do thoải mái.* khoá vân tay thuận tiện, an toàn cùng hệ thống camera 24/7* đội ngũ dọn dẹp vệ sinh chuyên nghiệp, sạch sẽ.* đầy đủ trang thiết bị từ tủ lạnh máy giặt đến chăn ga gối đệm.còn chần chứ gì không gọi ngay cho chúng tôi để đăng ký xem nhà và chọn những lựa chọn ưng ý nhất nào."
208,12/2020,4000000,27,21.0352224,105.7928088,"15 ngõ 329 Đường Cầu Giấy, Phường Dịch Vọng, Quận Cầu Giấy, Hà Nội", gấp  giá rẻ cầu giấy - 0961 846 333giá: 4 tr- 5trchủ nhà: 0961 846 333 như hình
207,12/2020,3000000,42,20.9556922,105.7573084,"20 Đường Ba La, Phường Phú Lương, Quận Hà Đông, Hà Nội"," có căn nhà cấp 4,  45m, khép kín chính chủ đang có nhu cầu  ,  giao thông thuận tiện ,cách quốc lộ 21b mấy phút đi bộ , đường vào tới nhà 4m rộng rãi ,gần các trường cao đẳng ,đại học ,gần 2 chợ lớn ,gần đường sắt trên cao cát linh-hà đông ,khu vực trong lành , an ninh tốt trong nhà đầy đủ nóng lạnh .điều hòa ,tủ quần áo , tủ lạnh ,2 giường ngủ , điện nước đóng theo giá nhà nước .mọi chi tiết xin liên hệ .thao 0366720798"
